{
  "contract_version": "1.0",
  "case_id": "dmz-ftp-2026-05-28",
  "module": "disk",
  "scan_started_at": "2026-05-28T21:29:58Z",
  "scan_completed_at": "2026-05-28T21:29:58Z",
  "summary": "23 finding(s) from disk artifacts (source: analyst.txt). 19 CONFIRMED, 4 INCONCLUSIVE, 0 REJECTED.",
  "counts": {
    "confirmed": 19,
    "inconclusive": 4,
    "rejected": 0
  },
  "findings": [
    {
      "finding_id": "disk-scan-f001",
      "verdict": "CONFIRMED",
      "severity": "CRITICAL",
      "mitre": [
        "T1003"
      ],
      "primary_entity": {
        "type": "file_path",
        "value": "SYSVOL\\Windows\\Temp\\perfmon\\PWDumpX.exe"
      },
      "related_entities": [],
      "justification": "PWDumpX.exe is a known credential-dumping tool placed in a masqueraded staging directory (Windows\\Temp\\perfmon). MFT confirms the file exists with no Zone.Identifier and no version info. Shimcache and amcache both record execution. Event 4688 and Sysmon event 1 confirm it was launched by DMZ-FTP\\rsydow at 2018-09-04T18:22:33 via cmd.exe. This finding is directly corroborated by MFT finding M001 (Finding 26), which independently flags the same file from the filesystem layer, and by Finding P002/M004 (PsExec co-located in the same perfmon directory), establishing a complete attack staging cluster.",
      "evidence": [
        {
          "source_file": "analyst.txt",
          "line": 42522,
          "content": "type=file path=Windows\\Temp\\perfmon\\PWDumpX.exe ... has_version_info=false suspicious_path=true",
          "verbatim": true,
          "timestamp": null
        },
        {
          "source_file": "analyst.txt",
          "line": 36439,
          "content": "type=event id=4688 time=\"2018-09-04 18:22:33...\" cmdline=\"C:\\\\Windows\\\\Temp\\\\perfmon\\\\PWDumpX.exe c:\\\\windows\\\\temp\\\\perfmon\\\\PWDumpX.exe\"",
          "verbatim": true,
          "timestamp": null
        },
        {
          "source_file": "analyst.txt",
          "line": 20248,
          "content": "type=event id=1 ... detail2=\"RuleName: Info=Executables Launched In Temp\" detail3=\"...SHA256=A23BB3BC0CB2CE9746F665D3CE874AEB168A3D2D6B8953AB541364DB6F6E9CA4...\"",
          "verbatim": true,
          "timestamp": null
        },
        {
          "source_file": "analyst.txt",
          "line": 58,
          "content": "type=execution path=SYSVOL\\Windows\\Temp\\perfmon\\PWDumpX.exe last_modified=\"2018-09-04 18:20:44\" executed=Yes",
          "verbatim": true,
          "timestamp": null
        },
        {
          "source_file": "analyst.txt",
          "line": 15,
          "content": "type=execution path=C:\\Windows\\Temp\\perfmon\\PWDumpX.exe link_date=\"2008-01-07 19:36:54\" artifact_source=amcache hash=sha256:600001da3f",
          "verbatim": true,
          "timestamp": null
        }
      ]
    },
    {
      "finding_id": "disk-scan-f002",
      "verdict": "CONFIRMED",
      "severity": "HIGH",
      "mitre": [
        "T1569.002"
      ],
      "primary_entity": {
        "type": "file_path",
        "value": "SYSVOL\\Windows\\Temp\\perfmon\\PsExec.exe"
      },
      "related_entities": [],
      "justification": "PsExec.exe was staged in the same attacker-controlled perfmon directory as PWDumpX.exe (Finding P001/M001). MFT, shimcache, and amcache all confirm presence and execution. Event 4688 shows rsydow executing it with \"-i -s powershell.exe\" (interactive SYSTEM shell) at 2018-09-04T18:32:20 and again at 22:51:49. System event 7045 confirms PSEXESVC was installed twice as a service. Sysmon fired \"Alert=Psexec Utilities\" on both executions. This is corroborated by MFT finding M004 (Finding 29).",
      "evidence": [
        {
          "source_file": "analyst.txt",
          "line": 36463,
          "content": "cmdline=\"C:\\\\Windows\\\\Temp\\\\perfmon\\\\PsExec.exe ... -i -s powershell.exe\"",
          "verbatim": true,
          "timestamp": null
        },
        {
          "source_file": "analyst.txt",
          "line": 171,
          "content": "type=event id=7045 time=\"2018-09-04 18:32:23...\" detail1=\"Name: PSEXESVC\" detail2=\"StartType: demand start\" detail3=\"Account: LocalSystem\"",
          "verbatim": true,
          "timestamp": null
        },
        {
          "source_file": "analyst.txt",
          "line": 20280,
          "content": "detail2=\"RuleName: Alert=Psexec Utilities\" detail3=\"...SHA256=3337E3875B05E0BFBA69AB926532E3F179E8CFBF162EBB60CE58A0281437A7EF...\"",
          "verbatim": true,
          "timestamp": null
        },
        {
          "source_file": "analyst.txt",
          "line": 47,
          "content": "type=execution path=SYSVOL\\Windows\\Temp\\perfmon\\PsExec.exe last_modified=\"2018-09-04 18:31:47\" executed=Yes",
          "verbatim": true,
          "timestamp": null
        },
        {
          "source_file": "analyst.txt",
          "line": 39549,
          "content": "type=file path=Windows\\Temp\\perfmon\\PsExec.exe ... suspicious_path=true",
          "verbatim": true,
          "timestamp": null
        }
      ]
    },
    {
      "finding_id": "disk-scan-f003",
      "verdict": "CONFIRMED",
      "severity": "HIGH",
      "mitre": [
        "T1560.001"
      ],
      "primary_entity": {
        "type": "file_path",
        "value": "C:\\ProgramData\\staging\\7za.exe"
      },
      "related_entities": [],
      "justification": "7za.exe in a directory literally named \"staging\" is a strong attacker convention. MFT confirms the file was created 2018-03-14T13:44:14 with no Zone.Identifier, consistent with lateral drop rather than download. Amcache confirms execution. The same date (2018-03-14) is the date of the log-clearing event on windows2012r2 (Finding E001), suggesting this staging activity preceded or accompanied the anti-forensics operation. MFT finding M010 (Finding 35) independently flags the same file.",
      "evidence": [
        {
          "source_file": "analyst.txt",
          "line": 17418,
          "content": "type=file path=ProgramData\\staging\\7za.exe ... created=2018-03-14T13:44:14Z ... suspicious_path=true",
          "verbatim": true,
          "timestamp": null
        },
        {
          "source_file": "analyst.txt",
          "line": 31,
          "content": "type=execution path=C:\\ProgramData\\staging\\7za.exe artifact_source=amcache hash=sha256:4000016b7f",
          "verbatim": true,
          "timestamp": null
        }
      ]
    },
    {
      "finding_id": "disk-scan-f004",
      "verdict": "CONFIRMED",
      "severity": "CRITICAL",
      "mitre": [
        "T1070.001"
      ],
      "primary_entity": {
        "type": "image_name",
        "value": "event_log_cleared"
      },
      "related_entities": [],
      "justification": "Four distinct Windows event logs (Security, System, Application, Setup) were cleared within the same second (2018-03-14T20:48:48) by WINDOWS2012R2\\Administrator, followed by a system shutdown 74 seconds later. This is a textbook systematic cover-up sequence. Both Security (id=1102) and System (id=104) log-clear events are present in the pivot evidence. The absence of earlier event log data on windows2012r2 must be interpreted in light of this confirmed clearing.",
      "evidence": [
        {
          "source_file": "analyst.txt",
          "line": 1,
          "content": "type=event id=1102 time=\"2018-03-14 20:48:48.2393303\" computer=windows2012r2 user=WINDOWS2012R2\\Administrator description=\"Event log cleared\"",
          "verbatim": true,
          "timestamp": null
        },
        {
          "source_file": "analyst.txt",
          "line": 1,
          "content": "type=event id=104 time=\"2018-03-14 20:48:48.2237185\" computer=windows2012r2 user=WINDOWS2012R2\\Administrator description=\"Event log cleared\" detail1=\"The System log file was cleared\"",
          "verbatim": true,
          "timestamp": null
        },
        {
          "source_file": "analyst.txt",
          "line": 2,
          "content": "type=event id=104 time=\"2018-03-14 20:48:48.2237185\" computer=windows2012r2 user=WINDOWS2012R2\\Administrator description=\"Event log cleared\" detail1=\"The Application log file was cleared\"",
          "verbatim": true,
          "timestamp": null
        },
        {
          "source_file": "analyst.txt",
          "line": 4,
          "content": "type=event id=13 time=\"2018-03-14 20:50:02.0824247\" computer=windows2012r2 description=\"OS was shutdown\"",
          "verbatim": true,
          "timestamp": null
        }
      ]
    },
    {
      "finding_id": "disk-scan-f005",
      "verdict": "CONFIRMED",
      "severity": "CRITICAL",
      "mitre": [
        "T1110.001"
      ],
      "primary_entity": {
        "type": "image_name",
        "value": "DMZ-FTP (-) [local svchost]"
      },
      "related_entities": [],
      "justification": "20,567 type-8 (network cleartext) logon failures targeting user \"mike\" originated from svchost.exe on dmz-ftp itself, indicating a compromised host running an automated credential-stuffing tool. This is corroborated by the subsequent successful type-8 logon for DMZ-FTP\\nfury (count=9) from the same host pattern (Finding E011), establishing a brute-force-then-success sequence. The event log summary confirms the full user and IP scope of activity on dmz-ftp.",
      "evidence": [
        {
          "source_file": "analyst.txt",
          "line": 1,
          "content": "Agent 1 source: Security.evtx id=4625 count=20567 type=8 user=\\\\mike; id=4624 type=8 user=nfury count=9",
          "verbatim": true,
          "timestamp": null
        },
        {
          "source_file": "analyst.txt",
          "line": 1,
          "content": "eventlog_security.txt total_hits=37549 time_range=2018-05-03\u21922018-09-07 (summarized pivot confirms scope)",
          "verbatim": true,
          "timestamp": null
        }
      ]
    },
    {
      "finding_id": "disk-scan-f006",